<?xml version="1.0" encoding="utf-8" ?>
<Persons xmlns:xsi="http://www.w3.org/2001/XMLSchema-instance"
         xmlns="http://jd02_09.akhmelev.it.by"
         xsi:schemaLocation="http://jd02_09.akhmelev.it.by Person.xsd">
    <Person>
        <Email>test123@mail.ru</Email>
        <Nickname>Test123</Nickname>
        <Password>qwerty</Password>
        <Ads>
            <Ad Rooms="2">
                <Description>Квартира в центре</Description>
                <Address>Минск, ул. Сухарево, 44 кв.23</Address>
                <Floor>2</Floor>
                <Floors>9</Floors>
                <Square>55</Square>
                <Price currency="$$$">77000</Price>
            </Ad>
            <Ad Rooms="3">
                <Description>Квартира в центре</Description>
                <Address>Минск, ул. Сухарево, 4 кв.24</Address>
                <Floor>2</Floor>
                <Floors>9</Floors>
                <Square>55</Square>
                <Price currency="$$$">77000</Price>
            </Ad>
        </Ads>
    </Person>
    <Person>
        <Email>test5673@mail.ru</Email>
        <Nickname>Test567</Nickname>
        <Password>qwerty</Password>
        <Ads>
            <Ad Rooms="2">
                <Description>Квартира в центре</Description>
                <Address>Пинск, ул. Ленина, 1 кв.1</Address>
                <Floor>4</Floor>
                <Floors>9</Floors>
                <Square>45.5</Square>
                <Price currency="$$$">77000</Price>
            </Ad>
        </Ads>
    </Person>
</Persons>